{
  "_description": "MEMORY_QUARANTINE event — RAG document flagged for prompt injection.",
  "protocol": "AIZP",
  "protocol_version": "V0.6",
  "wire_version": 2,
  "event": "MEMORY_QUARANTINE",
  "event_id": "c9d0e1f2-3456-4012-9345-90abcdef0123",
  "timestamp": "2026-05-19T10:09:00Z",
  "agent_id": "agent_alpha",
  "session_id": "sess_42",
  "payload": {
    "memory_id": "mem_xyz789",
    "memory_kind": "RAG_DOC",
    "trigger_metric": "prompt_injection_classifier_score",
    "trigger_value": 0.87,
    "trigger_threshold": 0.65,
    "evidence_text": "Retrieved document contains text starting with 'IGNORE PREVIOUS INSTRUCTIONS' — high prompt-injection probability.",
    "quarantine_action": "ISOLATE_FROM_RETRIEVAL",
    "auto_release_after_review": false
  }
}
